[
  {
    "id": "t_001",
    "type": "图文",
    "title": "新手第一天：怎么判断一个点能不能钓",
    "level": "入门",
    "duration": "6 分钟",
    "summary": "从禁钓规则、岸线安全、鱼获热度和停车补给四个维度判断。",
    "tags": ["#新手", "#合规", "#找点"],
    "coverTone": "blue"
  },
  {
    "id": "t_002",
    "type": "视频",
    "title": "路亚翘嘴：清晨和傍晚怎么选标点",
    "level": "进阶",
    "duration": "9 分钟",
    "summary": "看风向、缓流、明暗交界和小鱼活动，优先搜索水面窗口。",
    "tags": ["#路亚", "#翘嘴", "#实战"],
    "coverTone": "green"
  },
  {
    "id": "t_003",
    "type": "图文",
    "title": "台钓调漂最小闭环",
    "level": "入门",
    "duration": "8 分钟",
    "summary": "用一套简单步骤完成找底、调目、钓目和复盘。",
    "tags": ["#台钓", "#调漂", "#图文"],
    "coverTone": "amber"
  },
  {
    "id": "t_004",
    "type": "视频",
    "title": "夜钓出门前要准备什么",
    "level": "安全",
    "duration": "5 分钟",
    "summary": "照明、防滑、救生、补给和回程路线一次讲清。",
    "tags": ["#夜钓", "#安全", "#装备"],
    "coverTone": "purple"
  }
]
